<?xml version="1.0" encoding="UTF-8"?>
<?xml-stylesheet type="text/xsl" href="mercadillo.xsl"?>
<inventario xmlns:xsi="http://www.w3.org/2001/XMLSchema-instance"
            xsi:noNamespaceSchemaLocation="inventario.xsd">
    <item>
        <id>OBJ-001</id>
        <articulo>Ratón</articulo>
        <categoria>Electrónica</categoria>
        <estado>Para reparar</estado>
        <propietario>
            <nombre>Juan Pérez</nombre>
            <curso>1º ASIR</curso>
        </propietario>
    </item>
</inventario>
